{
  "adapter_id": "eudi-official",
  "build": {
    "configuration_sha256": "c877c666ba7993e6480a1fa55c25fe8009eab401be6b74e338f636ffdc50e729",
    "isolation": {
      "applied": false,
      "description": "No build-isolation artifact applied."
    },
    "production_source_unmodified": true
  },
  "claim_boundary": "Tyche-controlled execution at one selected pinned entry point. Applicability classifies entry-point scope, not product quality. This is not an independent reproduction, deployed workflow, vulnerability, certification or conformance result.",
  "decision_scope": {
    "checks_caller_supplied_or_bypassed": [
      "issuer-trust"
    ],
    "checks_exercised": [
      "syntax-parsing",
      "issuer-signature",
      "holder-binding",
      "nonce",
      "audience",
      "freshness"
    ],
    "notes": "Trust-chain decision was neutralised by the test classification callback; presentation-context checks use the selected validator entry point."
  },
  "dependency_material": {
    "paths": [
      "build.gradle.kts",
      "gradle/libs.versions.toml",
      "gradle/wrapper/gradle-wrapper.properties",
      "settings.gradle.kts"
    ],
    "sha256": "05c836672ee19b32aa6d0c2d1209ccb4974957e75c0572059965302a449e2b22"
  },
  "entry_point": {
    "identifier": "SdJwtVcValidator.validate",
    "kind": "library-api",
    "source_path": "src/main/kotlin/eu/europa/ec/eudi/verifier/endpoint/adapter/out/sdjwtvc/SdJwtVcValidator.kt"
  },
  "evaluation_context": {
    "audience": "https://rp.tyche.test",
    "evaluated_at": "2026-08-12T08:00:05Z",
    "nonce": "tyche-common-nonce-001"
  },
  "evidence_files": [
    {
      "path": "results/decision-scope-eudi-official-clone-2026-08-12.log",
      "sha256": "855b4392b8b020ea4634ed0ea07b8e9f12468f6155d39b494ca8435815b04e43"
    },
    {
      "path": "results/decision-scope-eudi-official-2026-08-12.log",
      "sha256": "09c678c42c4a8ab7f2b515fa90a010f32a99e78e89294ab940995c3bde67140a"
    }
  ],
  "execution": {
    "control": "tyche-controlled-local-run",
    "controller_identifier": "Tyche Institute",
    "environment_sha256": "878715fc28461c5183052031b94509c6333ca43987df919e90bf840ed6abab29",
    "executed_at": "2026-08-12T09:26:11.364438+00:00",
    "independent_of_tyche": false,
    "relationship_to_tyche": "study author controlled the execution"
  },
  "experiment_id": "urn:tyche:eudi:decision-scope-census:001",
  "input": {
    "corpus_sha256": "30fab5ed86987c156480ce6f64b5f5fa7a489b289406fdaaab7178252ab661d9",
    "format": "dc+sd-jwt"
  },
  "observations": [
    {
      "applicability": "IN_SCOPE",
      "case_id": "SCOPE_BASELINE_001",
      "comparison": "MATCH",
      "mutation_axis": "none",
      "normalized_reason": "NONE",
      "object_sha256": "5f44d7b96160024b6a505ca9077cb4f1d251f371e362e450d41e9b7e293fe9e3",
      "observed_verdict": "ACCEPT",
      "oracle_expected_verdict": "ACCEPT",
      "raw_reason": "NONE"
    },
    {
      "applicability": "IN_SCOPE",
      "case_id": "SCOPE_ISSUER_SIGNATURE_INVALID_001",
      "comparison": "MATCH",
      "mutation_axis": "issuer-signature",
      "normalized_reason": "INVALID_ISSUER_SIGNATURE",
      "object_sha256": "b4d876c9dfd24d80178eb3b68716d0b62c2432b742a3d701c9fc0f6abd4f203a",
      "observed_verdict": "REJECT",
      "oracle_expected_verdict": "REJECT",
      "raw_reason": "ContainsInvalidJwt"
    },
    {
      "applicability": "IN_SCOPE",
      "case_id": "SCOPE_KB_SIGNATURE_INVALID_001",
      "comparison": "MATCH",
      "mutation_axis": "key-binding-signature",
      "normalized_reason": "INVALID_HOLDER_BINDING",
      "object_sha256": "e3514386094d4caf2b27229fbb0be987c969e437bc64baa9b019cefb1f17d524",
      "observed_verdict": "REJECT",
      "oracle_expected_verdict": "REJECT",
      "raw_reason": "ContainsInvalidKeyBindingJwt"
    },
    {
      "applicability": "IN_SCOPE",
      "case_id": "SCOPE_NONCE_MISMATCH_001",
      "comparison": "MATCH",
      "mutation_axis": "nonce",
      "normalized_reason": "NONCE_MISMATCH",
      "object_sha256": "29fc4f2c23c1984321cea4784e8d1b29984ac1b0ef41f114c4fd44e2cabb3134",
      "observed_verdict": "REJECT",
      "oracle_expected_verdict": "REJECT",
      "raw_reason": "ContainsInvalidKeyBindingJwt"
    },
    {
      "applicability": "IN_SCOPE",
      "case_id": "SCOPE_AUDIENCE_MISMATCH_001",
      "comparison": "MATCH",
      "mutation_axis": "audience",
      "normalized_reason": "AUDIENCE_MISMATCH",
      "object_sha256": "c3479aae45d8966aca229cd4374a0ea6115b7526f51388c277827925d1e5fae4",
      "observed_verdict": "REJECT",
      "oracle_expected_verdict": "REJECT",
      "raw_reason": "ContainsInvalidKeyBindingJwt"
    },
    {
      "applicability": "IN_SCOPE",
      "case_id": "SCOPE_STALE_KB_IAT_001",
      "comparison": "MATCH",
      "mutation_axis": "freshness",
      "normalized_reason": "FRESHNESS_FAILURE",
      "object_sha256": "517beb4c0a5ff87e688ddd5a4d41fd5d836cce0f6092ab870a4cae12f6075c6d",
      "observed_verdict": "REJECT",
      "oracle_expected_verdict": "REJECT",
      "raw_reason": "ContainsInvalidKeyBindingJwt"
    }
  ],
  "policy_configuration_sha256": "65ffed9d399259f80a8d607909b37e5dbc001c00892072e88ea8ff122c341597",
  "receipt_id": "urn:tyche:eudi:provenance:eudi-official:decision-scope-census:2026-08-12",
  "record_status": "executed-observation",
  "repository": "https://github.com/eu-digital-identity-wallet/eudi-srv-verifier-endpoint",
  "schema_version": "1.1.0-research-candidate",
  "source_commit": "db5442501ea06907e614377a20d802748e8bfddb",
  "source_tree": "e04b44e81d2e052838bc2bbbc082006a213aa396",
  "trust_source": {
    "revision": "urn:tyche:eudi:decision-scope-census:001",
    "sha256": "30fab5ed86987c156480ce6f64b5f5fa7a489b289406fdaaab7178252ab661d9",
    "type": "synthetic-x5c-and-pinned-jwk"
  }
}
