{
  "adapter_id": "multipaz",
  "build": {
    "configuration_sha256": "a2d76dd074f0c1f765cf0da86d380e0ec45910f80ed7313bea2adc8e17d9b7ba",
    "isolation": {
      "applied": true,
      "artifact_path": "../build-isolation/multipaz-jvm-only.patch",
      "artifact_sha256": "2f8ca5f4b17edc47585c5ad86361057cdecede2d58b2f50f30aafd40868ce31a",
      "description": "JVM-only build-configuration isolation; production Kotlin source unchanged."
    },
    "production_source_unmodified": true
  },
  "claim_boundary": "Tyche-controlled execution at one selected pinned entry point. Applicability classifies entry-point scope, not product quality. This is not an independent reproduction, deployed workflow, vulnerability, certification or conformance result.",
  "decision_scope": {
    "checks_caller_supplied_or_bypassed": [
      "nonce",
      "audience",
      "freshness",
      "issuer-trust"
    ],
    "checks_exercised": [
      "syntax-parsing",
      "issuer-signature",
      "holder-binding"
    ],
    "notes": "Issuer key and nonce/audience/creation-time predicates are supplied by the caller; a JVM-only build-isolation patch is applied outside production Kotlin source."
  },
  "dependency_material": {
    "paths": [
      "build.gradle.kts",
      "gradle/libs.versions.toml",
      "gradle/wrapper/gradle-wrapper.properties",
      "multipaz/build.gradle.kts",
      "settings.gradle.kts"
    ],
    "sha256": "6da8da6a2bae78bfdf82b542cd338ac2a1d77b4719bbe8466179a95eb1988675"
  },
  "entry_point": {
    "identifier": "SdJwtKb.verify",
    "kind": "library-api",
    "source_path": "multipaz/src/commonMain/kotlin/org/multipaz/sdjwt/SdJwtKb.kt"
  },
  "evaluation_context": {
    "audience": "https://rp.tyche.test",
    "evaluated_at": "2026-08-12T08:00:05Z",
    "nonce": "tyche-common-nonce-001"
  },
  "evidence_files": [
    {
      "path": "results/decision-scope-multipaz-clone-2026-08-12.log",
      "sha256": "ad90406a03753822f856e51bcad044bc71005cde8c19cc85891e7852a4b4c9ec"
    },
    {
      "path": "results/decision-scope-multipaz-2026-08-12.log",
      "sha256": "2e8a347a426bbee0b39460c69f9408bad2d88098ed78f9f373e1a7c8e5c7f933"
    }
  ],
  "execution": {
    "control": "tyche-controlled-local-run",
    "controller_identifier": "Tyche Institute",
    "environment_sha256": "878715fc28461c5183052031b94509c6333ca43987df919e90bf840ed6abab29",
    "executed_at": "2026-08-12T09:26:11.364438+00:00",
    "independent_of_tyche": false,
    "relationship_to_tyche": "study author controlled the execution"
  },
  "experiment_id": "urn:tyche:eudi:decision-scope-census:001",
  "input": {
    "corpus_sha256": "30fab5ed86987c156480ce6f64b5f5fa7a489b289406fdaaab7178252ab661d9",
    "format": "dc+sd-jwt"
  },
  "observations": [
    {
      "applicability": "IN_SCOPE",
      "case_id": "SCOPE_BASELINE_001",
      "comparison": "MATCH",
      "mutation_axis": "none",
      "normalized_reason": "NONE",
      "object_sha256": "5f44d7b96160024b6a505ca9077cb4f1d251f371e362e450d41e9b7e293fe9e3",
      "observed_verdict": "ACCEPT",
      "oracle_expected_verdict": "ACCEPT",
      "raw_reason": "NONE"
    },
    {
      "applicability": "IN_SCOPE",
      "case_id": "SCOPE_ISSUER_SIGNATURE_INVALID_001",
      "comparison": "MATCH",
      "mutation_axis": "issuer-signature",
      "normalized_reason": "INVALID_ISSUER_SIGNATURE",
      "object_sha256": "b4d876c9dfd24d80178eb3b68716d0b62c2432b742a3d701c9fc0f6abd4f203a",
      "observed_verdict": "REJECT",
      "oracle_expected_verdict": "REJECT",
      "raw_reason": "org.multipaz.crypto.SignatureVerificationException: Error validating issuer signature"
    },
    {
      "applicability": "IN_SCOPE",
      "case_id": "SCOPE_KB_SIGNATURE_INVALID_001",
      "comparison": "MATCH",
      "mutation_axis": "key-binding-signature",
      "normalized_reason": "INVALID_HOLDER_BINDING",
      "object_sha256": "e3514386094d4caf2b27229fbb0be987c969e437bc64baa9b019cefb1f17d524",
      "observed_verdict": "REJECT",
      "oracle_expected_verdict": "REJECT",
      "raw_reason": "org.multipaz.crypto.SignatureVerificationException: Error validating KB signature"
    },
    {
      "applicability": "CALLER_SUPPLIED_POLICY",
      "case_id": "SCOPE_NONCE_MISMATCH_001",
      "comparison": "NOT_ASSESSED",
      "mutation_axis": "nonce",
      "normalized_reason": "NONCE_MISMATCH",
      "object_sha256": "29fc4f2c23c1984321cea4784e8d1b29984ac1b0ef41f114c4fd44e2cabb3134",
      "observed_verdict": "REJECT",
      "oracle_expected_verdict": "REJECT",
      "raw_reason": "java.lang.IllegalStateException: Failed verification of nonce"
    },
    {
      "applicability": "CALLER_SUPPLIED_POLICY",
      "case_id": "SCOPE_AUDIENCE_MISMATCH_001",
      "comparison": "NOT_ASSESSED",
      "mutation_axis": "audience",
      "normalized_reason": "AUDIENCE_MISMATCH",
      "object_sha256": "c3479aae45d8966aca229cd4374a0ea6115b7526f51388c277827925d1e5fae4",
      "observed_verdict": "REJECT",
      "oracle_expected_verdict": "REJECT",
      "raw_reason": "java.lang.IllegalStateException: Failed verification of audience"
    },
    {
      "applicability": "CALLER_SUPPLIED_POLICY",
      "case_id": "SCOPE_STALE_KB_IAT_001",
      "comparison": "NOT_ASSESSED",
      "mutation_axis": "freshness",
      "normalized_reason": "FRESHNESS_FAILURE",
      "object_sha256": "517beb4c0a5ff87e688ddd5a4d41fd5d836cce0f6092ab870a4cae12f6075c6d",
      "observed_verdict": "REJECT",
      "oracle_expected_verdict": "REJECT",
      "raw_reason": "java.lang.IllegalStateException: Failed verification of creationTime"
    }
  ],
  "policy_configuration_sha256": "c98d709b2e3b4719c9de89213ac367b5ae690093a8f61ed03515f53a242a6988",
  "receipt_id": "urn:tyche:eudi:provenance:multipaz:decision-scope-census:2026-08-12",
  "record_status": "executed-observation",
  "repository": "https://github.com/openwallet-foundation/multipaz",
  "schema_version": "1.1.0-research-candidate",
  "source_commit": "570aa2475bd5b7e437d9041bf8ff1127bcf86cfb",
  "source_tree": "29b6d52564f18addda552f5a0a7e4e690077d1e6",
  "trust_source": {
    "revision": "urn:tyche:eudi:decision-scope-census:001",
    "sha256": "30fab5ed86987c156480ce6f64b5f5fa7a489b289406fdaaab7178252ab661d9",
    "type": "synthetic-x5c-and-pinned-jwk"
  }
}
